{
  "schemaVersion": 1,
  "generatedAt": "2026-10-15T21:02:33.147993+00:00",
  "description": "Known water-transport stops used to map external-router ferry boarding coordinates to the internal ferry-free road areas.",
  "matchingPolicy": {
    "method": "nearest_known_stop",
    "maximumDistanceMeters": 500,
    "roadAreaDetection": "scan ferry boardings from the query origin and use the first boarding whose nearest known stop is within the maximum distance",
    "unknownEarlierFerries": "ignored",
    "arrivalStopRequired": false
  },
  "stops": [
    {
      "id": "Aasla",
      "coordinates": {
        "lon": 21.96155,
        "lat": 60.3138
      },
      "coordinateSource": "saaristolautat/public/data/saaristo.json",
      "name": "Aasla",
      "roadAreaId": "aasla",
      "roadAreaKind": "maintained_component"
    },
    {
      "id": "Airismaa",
      "coordinates": {
        "lon": 21.96326,
        "lat": 60.3162
      },
      "coordinateSource": "saaristolautat/public/data/saaristo.json",
      "name": "Airismaa",
      "roadAreaId": "mainland_finland",
      "roadAreaKind": "maintained_component"
    },
    {
      "id": "Angelniemi",
      "coordinates": {
        "lon": 22.943916,
        "lat": 60.31275
      },
      "coordinateSource": "saaristolautat/public/data/saaristo.json",
      "name": "Angelniemi",
      "roadAreaId": "mainland_finland",
      "roadAreaKind": "maintained_component"
    },
    {
      "id": "Aspholm",
      "coordinates": {
        "lon": 22.175431,
        "lat": 60.16559
      },
      "coordinateSource": "saaristolautat/public/data/saaristo.json",
      "name": "Aspholm",
      "roadAreaId": "stop:Aspholm",
      "roadAreaKind": "singleton_stop"
    },
    {
      "id": "Aspö",
      "coordinates": {
        "lon": 21.61429,
        "lat": 59.951518
      },
      "coordinateSource": "saaristolautat/public/data/saaristo.json",
      "name": "Aspö",
      "roadAreaId": "stop:Aspö",
      "roadAreaKind": "singleton_stop"
    },
    {
      "id": "Asterholma",
      "coordinates": {
        "lon": 21.03399,
        "lat": 60.30409
      },
      "coordinateSource": "saaristolautat/public/data/saaristo.json",
      "name": "Asterholma",
      "roadAreaId": "stop:Asterholma",
      "roadAreaKind": "singleton_stop"
    },
    {
      "id": "Bengtskär",
      "coordinates": {
        "lon": 22.500117,
        "lat": 59.723477
      },
      "coordinateSource": "saaristolautat/public/data/saaristo.json",
      "name": "Bengtskär",
      "roadAreaId": "stop:Bengtskär",
      "roadAreaKind": "singleton_stop"
    },
    {
      "id": "Berghamn",
      "coordinates": {
        "lon": 21.80163,
        "lat": 60.05439
      },
      "coordinateSource": "saaristolautat/public/data/saaristo.json",
      "name": "Berghamn",
      "roadAreaId": "stop:Berghamn",
      "roadAreaKind": "singleton_stop"
    },
    {
      "id": "BerghamnE",
      "coordinates": {
        "lon": 19.535583,
        "lat": 60.22562
      },
      "coordinateSource": "saaristolautat/public/data/saaristo.json",
      "name": "Eckerön Berghamn",
      "roadAreaId": "mainland_aland",
      "roadAreaKind": "maintained_component"
    },
    {
      "id": "BerghamnK",
      "coordinates": {
        "lon": 21.30346,
        "lat": 60.14876
      },
      "coordinateSource": "saaristolautat/public/data/saaristo.json",
      "name": "BerghamnK",
      "roadAreaId": "stop:BerghamnK",
      "roadAreaKind": "singleton_stop"
    },
    {
      "id": "Bergö",
      "coordinates": {
        "lon": 20.39284,
        "lat": 60.16268
      },
      "coordinateSource": "saaristolautat/public/data/saaristo.json",
      "name": "Bergö",
      "roadAreaId": "stop:Bergö",
      "roadAreaKind": "singleton_stop"
    },
    {
      "id": "Biskopsö",
      "coordinates": {
        "lon": 22.559911,
        "lat": 59.971083
      },
      "coordinateSource": "saaristolautat/public/data/saaristo.json",
      "name": "Biskopsö",
      "roadAreaId": "stop:Biskopsö",
      "roadAreaKind": "singleton_stop"
    },
    {
      "id": "Björkholm",
      "coordinates": {
        "lon": 22.23607,
        "lat": 60.18521
      },
      "coordinateSource": "saaristolautat/public/data/saaristo.json",
      "name": "Björkholm",
      "roadAreaId": "stop:Björkholm",
      "roadAreaKind": "singleton_stop"
    },
    {
      "id": "Björkö",
      "coordinates": {
        "lon": 21.69181,
        "lat": 59.914106
      },
      "coordinateSource": "saaristolautat/public/data/saaristo.json",
      "name": "Björkö",
      "roadAreaId": "stop:Björkö",
      "roadAreaKind": "singleton_stop"
    },
    {
      "id": "BjörköH",
      "coordinates": {
        "lon": 21.40591,
        "lat": 60.26568
      },
      "coordinateSource": "saaristolautat/public/data/saaristo.json",
      "name": "BjörköH",
      "roadAreaId": "kivimo",
      "roadAreaKind": "maintained_component"
    },
    {
      "id": "BjörköK",
      "coordinates": {
        "lon": 20.94159,
        "lat": 60.31105
      },
      "coordinateSource": "saaristolautat/public/data/saaristo.json",
      "name": "BjörköK",
      "roadAreaId": "stop:BjörköK",
      "roadAreaKind": "singleton_stop"
    },
    {
      "id": "Bockholm",
      "coordinates": {
        "lon": 21.19089,
        "lat": 60.31457
      },
      "coordinateSource": "saaristolautat/public/data/saaristo.json",
      "name": "Bockholm",
      "roadAreaId": "stop:Bockholm",
      "roadAreaKind": "singleton_stop"
    },
    {
      "id": "Bodö",
      "coordinates": {
        "lon": 21.75024,
        "lat": 59.908368
      },
      "coordinateSource": "saaristolautat/public/data/saaristo.json",
      "name": "Bodö",
      "roadAreaId": "stop:Bodö",
      "roadAreaKind": "singleton_stop"
    },
    {
      "id": "Bolax",
      "coordinates": {
        "lon": 22.710532,
        "lat": 59.945743
      },
      "coordinateSource": "saaristolautat/public/data/saaristo.json",
      "name": "Bolax",
      "roadAreaId": "stop:Bolax",
      "roadAreaKind": "singleton_stop"
    },
    {
      "id": "Borstö",
      "coordinates": {
        "lon": 21.96935,
        "lat": 59.8621
      },
      "coordinateSource": "saaristolautat/public/data/saaristo.json",
      "name": "Borstö",
      "roadAreaId": "stop:Borstö",
      "roadAreaKind": "singleton_stop"
    },
    {
      "id": "Brunskär",
      "coordinates": {
        "lon": 21.50121,
        "lat": 60.04182
      },
      "coordinateSource": "saaristolautat/public/data/saaristo.json",
      "name": "Brunskär",
      "roadAreaId": "stop:Brunskär",
      "roadAreaKind": "singleton_stop"
    },
    {
      "id": "Brännskär",
      "coordinates": {
        "lon": 21.97593,
        "lat": 60.08634
      },
      "coordinateSource": "saaristolautat/public/data/saaristo.json",
      "name": "Brännskär",
      "roadAreaId": "stop:Brännskär",
      "roadAreaKind": "singleton_stop"
    },
    {
      "id": "Byskär",
      "coordinates": {
        "lon": 21.96986,
        "lat": 60.08417
      },
      "coordinateSource": "saaristolautat/public/data/saaristo.json",
      "name": "Byskär",
      "roadAreaId": "stop:Byskär",
      "roadAreaKind": "singleton_stop"
    },
    {
      "id": "Bötesö",
      "coordinates": {
        "lon": 22.612814,
        "lat": 59.943749
      },
      "coordinateSource": "saaristolautat/public/data/saaristo.json",
      "name": "Bötesö",
      "roadAreaId": "stop:Bötesö",
      "roadAreaKind": "singleton_stop"
    },
    {
      "id": "Dalen",
      "coordinates": {
        "lon": 21.37135,
        "lat": 60.38157
      },
      "coordinateSource": "saaristolautat/public/data/saaristo.json",
      "name": "Dalen",
      "roadAreaId": "inio",
      "roadAreaKind": "maintained_component"
    },
    {
      "id": "Dalsbruk",
      "coordinates": {
        "lon": 22.513464,
        "lat": 60.019246
      },
      "coordinateSource": "saaristolautat/public/data/saaristo.json",
      "name": "Dalsbruk",
      "roadAreaId": "mainland_finland",
      "roadAreaKind": "maintained_component"
    },
    {
      "id": "Degerby",
      "coordinates": {
        "lon": 20.38586,
        "lat": 60.03185
      },
      "coordinateSource": "saaristolautat/public/data/saaristo.json",
      "name": "Degerby",
      "roadAreaId": "foglo",
      "roadAreaKind": "maintained_component"
    },
    {
      "id": "Djupö",
      "coordinates": {
        "lon": 22.560336,
        "lat": 59.956664
      },
      "coordinateSource": "saaristolautat/public/data/saaristo.json",
      "name": "Djupö",
      "roadAreaId": "stop:Djupö",
      "roadAreaKind": "singleton_stop"
    },
    {
      "id": "Elvsö",
      "coordinates": {
        "lon": 21.48066,
        "lat": 60.13858
      },
      "coordinateSource": "saaristolautat/public/data/saaristo.json",
      "name": "Elvsö",
      "roadAreaId": "stop:Elvsö",
      "roadAreaKind": "singleton_stop"
    },
    {
      "id": "Enklinge",
      "coordinates": {
        "lon": 20.75108,
        "lat": 60.31836
      },
      "coordinateSource": "saaristolautat/public/data/saaristo.json",
      "name": "Enklinge",
      "roadAreaId": "stop:Enklinge",
      "roadAreaKind": "singleton_stop"
    },
    {
      "id": "Fagerholm",
      "coordinates": {
        "lon": 21.69828,
        "lat": 60.11203
      },
      "coordinateSource": "saaristolautat/public/data/saaristo.json",
      "name": "Fagerholm",
      "roadAreaId": "stop:Fagerholm",
      "roadAreaKind": "singleton_stop"
    },
    {
      "id": "Finholma",
      "coordinates": {
        "lon": 20.5264,
        "lat": 60.0746
      },
      "coordinateSource": "saaristolautat/public/data/saaristo.json",
      "name": "Finholma",
      "roadAreaId": "foglo",
      "roadAreaKind": "maintained_component"
    },
    {
      "id": "Finnö",
      "coordinates": {
        "lon": 21.5089,
        "lat": 60.18082
      },
      "coordinateSource": "saaristolautat/public/data/saaristo.json",